,question,target,CoT,is_true,verifier
62,"Mark took a test of 75 questions yesterday, completing it at a rate of 5 questions per hour. Today, he took another test of 100 questions at the same rate. If Mark had 8 hours to complete the first test and 6 hours for the second, how many questions did he not answer?",105,"{0: [[""Mark took X questions on the first test, completing it at a rate of 5 questions per hour. He had 8 hours to complete the first test, so the total number of questions on the first test is:\nX = 8 * 5 = 40\n\nSince he didn't answer 21 questions on the second test of 100 questions, he answered 100 - 21 = 79 questions. He took 6 hours to complete the second test, so he answered 79 questions in 6 hours, meaning he answered questions at a rate of:\n79 / 6 ≈ 13.17 questions per hour\n\nSince this rate is the same for both tests, we can set up the equation:\n40 / 5 = 79 / 13.17\n8 = 6\n\nThis equation does not hold true, so there seems to be an error in the calculations. Let's reevaluate the problem."", 'Mark took a test of X questions yesterday, completing it at a rate of 5 questions per hour for 8 hours, so he answered 8 * 5 = 40 questions on the first test. Today, he took a test of 100 questions at the same rate for 6 hours, so he answered 6 * 5 = 30 questions on the second test. Since he did not answer 21 questions on the second test, he must have answered 100 - 21 = 79 questions on the second test. Therefore, the total number of questions he answered is 40 + 79 = 119. Since he had 8 hours to complete the first test, we can write the following equation:\n<code>X = 5 * 8\n X = 40\n</code>\nThe answer is 40.', 'Mark took a test of X questions yesterday at a rate of 5 questions per hour, so he took X/5 hours to complete it. Today, he took a test of 100 questions at the same rate, so he took 100/5 = 20 hours to complete it. \nHe had 8 hours to complete the first test and 6 hours for the second. So, he did not answer 21 questions in total. Therefore, we can write the following equation:\n8 + 20 = 28 hours\n28 - 21 = 7 hours\nX/5 + 20 = 7\nX/5 = 7 - 20\nX/5 = -13\nX = -13 * 5\nX = -65\nThe answer is -65.'], [""Let's break down the information given:\n\nYesterday, Mark took a test with 7X questions at a rate of X questions per hour. He completed it in 8 hours.\nToday, Mark took a test with 100 questions at the same rate. He completed it in 6 hours.\nHe did not answer 21 questions.\n\nUsing the information given, we can create two equations:\n\nFor the first test:\n7X = 8X\n8 = 7X\nX = 8/7\n\nFor the second test:\n100 = 6X\n\nSubstitute the value of X from the first equation into the second equation:\n100 = 6*(8/7)\n100 = 48/7\nX = 14\n\nTherefore, the answer for X is 14."", ""To find the value of 'X', we can first find the total number of questions Mark answered in each test.\n\nFor the first test:\nTotal questions = 7X\nTotal time taken = 8 hours\nRate = X questions per hour\n\nSo, the total questions answered in the first test = X * 8 = 8X\n\nFor the second test:\nTotal questions = 100\nTotal time taken = 6 hours\nRate = X questions per hour\n\nSo, the total questions answered in the second test = X * 6 = 6X\n\nThe total questions Mark answered in both tests = 8X + 6X = 14X\n\nGiven that Mark did not answer 21 questions, we can write:\n14X = 100 - 21\n14X = 79\nX = 79 / 14\nX = 5.64 (rounded to the nearest whole number)\n\nTherefore, the answer is X = 6."", 'Mark took a test of 7X questions yesterday at a rate of X questions per hour, so he took 7X / X = 7 hours to complete the first test. \nToday, he took a test of 100 questions at the same rate, so he took 100 / X hours to complete the second test. \nHe had 8 hours for the first test and 6 hours for the second test, so:\n7 = 8\n100 / X = 6\nHe did not answer 21 questions on the second test, so:\n100 - 21 = 79\n100 / X = 79\nX = 100 / 79 = 1.265\nThe answer is X = 1.265.'], [""Mark took 8 hours to complete the first test of 75 questions, so he answered 5 questions per hour. Therefore, he answered 8 * 5 = 40 questions on the first test. He had 35 questions left unanswered on the first test. \n\nOn the second test, he took 6 hours to complete 'X' questions at the same rate of 5 questions per hour. Therefore, he answered 6 * 5 = 30 questions on the second test. Since he did not answer 21 questions in total, we can write the following equation:\n\n35 + 30 + X = 75\n65 + X = 75\nX = 75 - 65\nX = 10\n\nTherefore, the answer is 10."", 'For the first test, Mark answered 5 questions per hour for 8 hours, so he answered 5 * 8 = 40 questions.\nFor the second test, Mark answered 5 questions per hour for 6 hours, so he answered 5 * 6 = 30 questions.\nIn total, Mark answered 40 + 30 = 70 questions.\nSince Mark did not answer 21 questions, we can find the answer for X by subtracting the answered questions from the total number of questions: \nX = 75 - 70 - 21\nX = 5\nThe answer is 5.', 'Mark took 8 hours to complete the first test, so he answered 8 * 5 = 40 questions on the first test. He did not answer 75 - 40 = 35 questions on the first test. \n\nHe took 6 hours to complete the second test, so he answered 6 * 5 = 30 questions on the second test. Since he did not answer 21 questions, that means he answered X - 21 questions on the second test.\n\nTherefore, the total number of questions he answered on the second test is X - 21. This total number of questions should add up to 30 just like the first test. So we can write the equation:\n\n35 + (X - 21) = 30\n\nCombine like terms:\n\nX - 21 + 35 = 30\n\nX + 14 = 30\n\nX = 30 - 14\n\nX = 16\n\nTherefore, the answer is 16.']], 1: [[""Let's break down the information given:\n- Mark completed the first test of X questions at a rate of 5 questions per hour in 8 hours, so the total number of questions in the first test is 5 * 8 = 40.\n- Mark completed the second test of 100 questions at a rate of 5 questions per hour in 6 hours, so the total number of questions in the second test is 5 * 6 = 30.\n\nSince Mark did not answer 105 questions, we can set up the equation:\nTotal questions - (Questions from 1st test + Questions from 2nd test) = 105\nX + 100 - (40 + 30) = 105\nX + 100 - 70 = 105\nX + 30 = 105\nX = 105 - 30\nX = 75\n\nTherefore, the answer is X = 75."", ""Let's calculate the total number of questions Mark answered in the first test and the second test:\n\nFor the first test:\n8 hours * 5 questions per hour = 40 questions\n\nFor the second test:\n6 hours * 5 questions per hour = 30 questions\n\nTotal questions answered by Mark = 40 + 30 = 70\n\nHe did not answer 105 questions, so:\nX + 100 - 70 = 105\nX + 30 = 105\nX = 75\n\nThe answer is 75."", 'Mark took the first test with X questions at a rate of 5 questions per hour, so he took X/5 hours to complete it. He had 8 hours to complete the first test, so:\nX/5 = 8\nX = 5 * 8\nX = 40\n\nFor the second test of 100 questions, he took 100/5 = 20 hours to complete it. He had 6 hours for the second test, so he did not answer 20-6 = 14 questions.\n\nHe did not answer a total of 40 + 14 = 54 questions.'], [""Let's first calculate how many questions Mark answered in total for both tests. For the first test, he answered X questions at a rate of X questions per hour, so he took X hours to complete it. Similarly, for the second test of 100 questions, he took 6 hours to complete it. \n\nFor the first test, he answered 7X questions in total. For the second test, he answered 100 questions in total. So, the total number of questions he answered is:\n7X + 100\n\nSince he did not answer 105 questions in total, we can write the following equation:\n7X + 100 = 105\n\nSolving for X:\n7X = 105 - 100\n7X = 5\nX = 5/7\n\nThe answer is 5/7 or approximately 0.71."", ""Let's set up the equations based on the information given. \n\nFor the first test:\n- Mark took X questions per hour, completing the test in 8 hours. Therefore, the total number of questions in the first test is 7X.\nFor the second test:\n- Mark also took X questions per hour, completing the test in 6 hours. Therefore, the total number of questions in the second test is 100.\n\nBased on the information given, Mark did not answer 105 questions. This means that the total number of questions Mark answered in both tests is 7X + 100, and he should have answered 105 more questions. Therefore, we can set up the equation:\n\n7X + 100 - 105 = 7X + 100 - 105\n\nSimplifying the equation:\n\n7X - 5 = 100\n\n7X = 105\n\nX = 15\n\nTherefore, the answer of 'X' is 15."", ""Let's first find out how many questions Mark answered in total on both tests. For the first test, he completed 'X' questions in 8 hours, so the rate is X/8 questions per hour. So, he answered a total of 7X questions on the first test. \n\nFor the second test, he completed 100 questions in 6 hours at the same rate of X/8 questions per hour, so he answered 6*(X/8) = 3X/4 questions on the second test.\n\nIn total, he answered 7X + 3X/4 questions on both tests. This should be equal to the total questions minus the 105 questions he did not answer:\n\n7X + 3X/4 = 7X + 0.75X = 7.75X\nBut, he did not answer 105 questions, so:\n7.75X = total questions - 105\n\nGiven that the total questions include the 7X questions from the first test and 100 questions from the second test, we can write:\n7X + 100 = total questions\n\nNow, we can solve the two equations simultaneously:\n7.75X = 7X + 100 - 105\n7.75X = 7X - 5\n0.75X = -5\nX = -5 / 0.75\nX = -6.67\n\nTherefore, the answer for 'X' is -6.67.""], [""Mark took 75 questions yesterday at a rate of 5 questions per hour for 8 hours, so he completed all 75 questions. Today, he took another test of X questions at the same rate for 6 hours. In total, he did not answer 105 questions, so we can write the following equation:\n<code> 75 + 5*8 + X + 5*6 = 105\n 75 + 40 + X + 30 = 105\n X + 145 = 105\n X = 105 - 145\n X = -40\n</code>\nThe answer is -40, which doesn't make sense in this context. It's possible that there was an error in the problem statement."", 'Mark took 75 questions test yesterday at a rate of 5 questions per hour, so it took him 75 / 5 = 15 hours to complete the first test. Today, he took another test of X questions at the same rate, taking him 6 hours to complete it. Together, Mark had 8 + 6 = 14 hours to complete both tests. Since he did not answer 105 questions, we can write the following equation:\n\\[\n75 + X = 14 \\times 5\n\\]\n\\[\nX = 70\n\\]\nThe answer is 70.', ""Mark took 75 questions yesterday, so he answered 5 * 8 = 40 questions during that time. Yesterday's remaining number of questions would be 75 - 40 = 35.\nToday, Mark took another test of X questions, completing it in 6 hours, so he answered 5 * 6 = 30 questions during that time. \nThe total unanswered questions is therefore 35 + X - 30 = 105.\nSolving for X:\n35 + X - 30 = 105\nX + 5 = 105\nX = 105 - 5\nX = 100\n\nTherefore, the answer is 100.""]], 2: [['To find the value of X, we need to first calculate how many questions Mark answered in total for both tests. \n\nFor the first test, Mark answered 5 questions per hour for 8 hours, so he answered 5 * 8 = 40 questions.\nFor the second test, Mark answered 5 questions per hour for 6 hours, so he answered 5 * 6 = 30 questions.\n\nHe answered a total of 40 + 30 = 70 questions for both tests.\nSince he did not answer 75 questions, the total number of questions on both tests is 75 + 70 = 145.\n\nTherefore, the value of X, which is the number of questions on the first test, is 145 - 100 (questions on the second test) = 45.\n\nSo, X = 45.', ""Mark took X questions on the first test and 100 questions on the second test. He completes each test at a rate of 5 questions per hour, meaning he spent 8 hours on the first test and 6 hours on the second test. He did not answer 75 questions. \n\nFor the first test:\n<code> X = 8 * 5\n X = 40 \n</code>\n\nFor the second test:\n<code> 100 = 6 * 5\n 100 = 30 \n</code>\n\nThe total number of questions he should have answered is:\n<code> 40 + 30 = 70\n 70 + 75 = 145 \n</code>\n\nTherefore, the answer of 'X' is 40."", ""Mark took 'X' questions on the first test, completing it at a rate of 5 questions per hour. So, he took X/5 hours to complete the first test. He had 8 hours to complete the first test, so we can write:\nX/5 = 8\nX = 5 * 8\nX = 40\n\nMark took 100 questions on the second test, at the same rate of 5 questions per hour. He had 6 hours to complete the second test, so we can write:\n100/5 = 6\n\nMark did not answer 75 questions, so the total number of questions he answered on both tests was:\n40 + 100 - 75 = 65\n\nTherefore, the answer is X = 40.""], ['Mark took a test of 7X questions completing it at a rate of X questions per hour. So it took him 7 hours to complete the first test. Mark also took a 100-question test at the same rate, which took him 100/X hours. In total, he had 8 hours for the first test and 6 hours for the second test, so:\n7 + 100/X = 8\n100/X = 1\nX = 100\nTherefore, the answer is X = 100.', ""Let's first find out how many questions Mark answered in total for both tests. For the first test, Mark had 8 hours to complete X questions at a rate of X questions per hour, so he answered 8X questions. \nFor the second test, Mark had 6 hours to complete 100 questions at the same rate, so he answered 6X questions. \nTherefore, the total questions Mark answered for both tests is 8X + 6X = 14X.\n\nSince Mark did not answer 75 questions, we can set up the following equation:\n14X - 75 = total questions answered\n14X - 75 = 8X + 6X\n14X - 8X - 6X = 75\n0 = 75\n\nThis equation has no solution, which means there might be an error in the information provided."", 'Mark took a test of 7X questions yesterday at a rate of X questions per hour. So he took a total of 7X / X = 7 hours to complete the first test. Since he had 8 hours to complete the test, we have:\n\n7X = 8\n\nX = 8 / 7 = 1.14 (rounded to 2 decimal places)\n\nToday, he took another test of 100 questions at the same rate, which means he took 100 / X = 100 / 1.14 = 87.72 hours. Since he had 6 hours to complete the second test, we have:\n\n100 / X = 6\n\n100 / 1.14 = 6\n\nX = 100 / 6 = 16.67 (rounded to 2 decimal places)\n\nHe did not answer 75 questions, so we have:\n\n7X + 100 - 75 = 7(16.67) + 100 - 75 = 120.69\n\nTherefore, the answer for X is approximately 16.67.'], [""For the first test, Mark completed 75 questions at a rate of 5 questions per hour in 8 hours. So, he answered 5 x 8 = 40 questions. This means he did not answer 75 - 40 = 35 questions in the first test.\n\nFor the second test, he completed 'X' questions at the same rate in 6 hours. Since he did not answer 35 questions in the first test, those 35 questions must be part of the second test. Therefore, we can set up the equation:\n\n35 + X = 75\nX = 75 - 35\nX = 40\n\nThe answer is 40."", 'Mark took 75 questions at a rate of 5 questions per hour, so he took 75 / 5 = 15 hours to complete the first test. Since he had 8 hours to complete the test, he did not answer all 75 questions.\n\nOn the second test, Mark took X questions at the same rate of 5 questions per hour. If he had 6 hours to complete the second test, then he was able to answer X / 5 = 6 questions in total.\n\nTherefore, we can write the equation:\n15 + (X/5) = 75\n\nSolving for X:\nX/5 = 75 - 15\nX/5 = 60\nX = 60 * 5\nX = 300\n\nThe answer is 300.', 'Mark took 75 questions at a rate of 5 questions per hour, so it took him 75 / 5 = 15 hours to complete the first test. He had 8 hours to complete it, so he did not complete it. \nFor the second test, he took X questions at the same rate. It took him 6 hours to complete it, but he did not answer all X questions. \nTherefore, there is no solution for X that satisfies the given conditions.']]}","[False, True, False]",0
63,"Jordan plays video games for 2 hours every day. He also has a part-time job that pays $10 per hour. If Jordan spent his gaming time working instead, how much money could he earn in a week?",140,[],[True],1
64,"Johnny is picking up toys from the floor of his room. He dumped a set of 500-piece Legos, another set that is three times larger than the 500-piece set, and a set that is only a quarter of the size of the larger set. If Johnny is to pick up all the Legos, how many pieces must he pick up?",2125,[],[False],0
65,"John buys 2 pairs of shoes for each of 3 children, each pair costing $60. How much does he pay?",360,[],[True],1
66,Violetta wants to buy new crayons. She needs 5 different colors and has prepared 20 dollars for this purchase. A crayon costs 2 dollars. How much change will she receive?,10,[],[True],1
67,"In a beehive with 700 bees, the number of worker bees is twice the number of larvae, and the number of larvae is twice the number of queen bees. How many worker bees are there?",400,[],[True],1
68,"A classroom has a whiteboard shared by 4 teachers, who take turns using the classroom. Each teacher has 2 classes per day, and each class uses the whiteboard. If the whiteboard is wiped 3 times per class, how many times is the whiteboard wiped per day?",24,[],[True],1
69,"Steve decides to start eating more tomatoes and decides to grow his own cherry tomatoes. He eats twice as much as his girlfriend. He eats 6 a day. If a vine produces 3 tomatoes a week, how many vines does he need?",21,"{0: [['Steve eats X tomatoes a day, which is twice as much as his girlfriend. So his girlfriend eats X/2 tomatoes a day.\nTogether, they eat X + X/2 = 3X/2 tomatoes a day.\nIf a vine produces 3 tomatoes a week, they need to eat 21 vines worth of tomatoes, which is 3*21=63 tomatoes.\nSo, 3X/2 = 63\n3X = 126\nX = 42\nThe answer is 42.', ""Steve eats twice as much as his girlfriend, so let's say his girlfriend eats Y tomatoes a day. Therefore, Steve eats 2Y tomatoes a day. Each vine produces 3 tomatoes a week, so to get 21 tomatoes a week, Steve needs 21/3 = 7 vines. Since each vine produces 3 tomatoes per week, Steve needs to eat 7 * 3 = 21 tomatoes per week.\n<code> 2Y = X\n X = 21\n 2Y = 21\n Y = 10.5\n</code>\nThe answer is 10.5."", ""Let's break it down:\n\n1. Steve eats twice as much as his girlfriend, so his girlfriend eats X/2 tomatoes a day.\n2. Together, they eat X + X/2 = 3X/2 tomatoes a day.\n3. A vine produces 3 tomatoes a week, so in one day, a vine produces 3/7 tomatoes.\n4. Steve needs 21 vines, so in one day, all vines produce 21 * 3/7 = 9 tomatoes.\n5. Therefore, 3X/2 = 9, solving for X:\n<code> 3X/2 = 9\n X = 6\n</code>\nThe answer is 6 tomatoes a day.""], ['Steve eats 6 tomatoes a day, which is twice as much as his girlfriend. So his girlfriend eats 6/2 = 3 tomatoes a day. This means together they eat 6 + 3 = 9 tomatoes a day. If a vine produces X tomatoes a week, then in 1 day it produces X/7 tomatoes. Steve needs 21 vines, so he needs to be able to produce 21 * (X/7) = 21X/7 = 3X tomatoes a day. This means:\n\\[3X = 9\\]\n\\[X = 3\\]\nThe answer is 3.', 'Steve eats 6 cherry tomatoes a day, which is twice as much as his girlfriend. So, his girlfriend eats 3 cherry tomatoes a day. If a vine produces X tomatoes a week, then in a day it produces X/7 tomatoes. Since Steve needs 21 vines, the total number of tomatoes produced in a day should be 21 * X/7. We can set up the equation as follows:\n\\[6 + 3 = 21 \\cdot \\frac{X}{7}\\]\n\\[9 = \\frac{21X}{7}\\]\n\\[63 = 21X\\]\n\\[X = \\frac{63}{21}\\]\n\\[X = 3\\]\n\nTherefore, the answer is 3 tomatoes per vine per week.', 'Steve eats 6 tomatoes a day. Since he eats twice as much as his girlfriend, his girlfriend eats 3 tomatoes a day. Together, they eat 6 + 3 = 9 tomatoes a day. If a vine produces X tomatoes a week, Steve needs 21 vines to have enough tomatoes for their daily consumption.\n\nTo find X, we can calculate the weekly production needed for 21 vines:\n9 tomatoes/day * 7 days/week = 63 tomatoes/week\n\nSo, we have the equation:\nX * 21 = 63\n\nSolving for X, we get:\nX = 63 / 21\nX = 3\n\nTherefore, each vine produces 3 tomatoes a week.']], 1: [[""Steve's girlfriend eats 'X' tomatoes a day. Since Steve eats twice as much as his girlfriend, he eats 2X tomatoes a day. A vine produces 3 tomatoes a week, so Steve needs 3.0 vines. So we can write the following equation:\n<code> 2X = 3.0 * 3\n 2X = 9.0\n X = 9.0 / 2\n X = 4.5\n</code>\nThe answer is 4.5 tomatoes a day."", ""Let's break this down:\n\n- Steve eats 'X' tomatoes a day.\n- His vine produces 3 tomatoes a week.\n- Steve needs 3.0 vines to sustain his tomato consumption.\n\nIf Steve eats 'X' tomatoes a day, he eats twice as much as his girlfriend, who eats 'X/2' tomatoes a day.\n\nIn a week, Steve eats a total of 7*X tomatoes, and his vines produce 3*3.0=9 tomatoes.\n\nTherefore, to sustain his tomato consumption:\n\n7*X = 9\nX = 9/7\nX = 1.2857\n\nSo, Steve eats approximately 1.2857 tomatoes a day."", ""First, we need to determine how many tomatoes Steve eats in a week since the vine produces 3 tomatoes a week. If he eats 'X' tomatoes a day, then in a week he eats 7*X tomatoes. Since he eats twice as much as his girlfriend, we can say his girlfriend eats X/2 tomatoes a day. Therefore, in a week she eats 7*(X/2) = 3.5*X tomatoes.\n\nSteve needs 3 vines to produce 3.0*3 = 9 tomatoes a week. So, the total number of tomatoes Steve and his girlfriend eat in a week is 7*X + 7*(X/2) = 9. Solving for X:\n\n<code>7*X + 7*(X/2) = 9\n7*X + 3.5*X = 9\n10.5*X = 9\nX = 9 / 10.5\nX ≈ 0.857</code>\n\nTherefore, Steve eats approximately 0.857 cherry tomatoes a day.""], [""Steve eats 6 tomatoes a day, which is twice as much as his girlfriend. So his girlfriend eats 6/2 = 3 tomatoes a day. Together, they eat 6 + 3 = 9 tomatoes a day. Since Steve needs 3 vines, and each vine produces 'X' tomatoes a week, we can write the equation:\n\nVines * X = Total Tomatoes Eaten\n3 * X = 9 * 7\n3X = 63\nX = 21\n\nTherefore, each vine produces 21 tomatoes a week."", 'Steve eats 6 cherry tomatoes a day, which is twice as much as his girlfriend. So his girlfriend eats 6/2 = 3 cherry tomatoes a day.\nIf Steve needs 3.0 vines in total, and each vine produces X tomatoes a week, then the total number of tomatoes he needs is 3.0 * X.\nWe know that he eats 6 cherry tomatoes a day, so in a week he eats 6 * 7 = 42 cherry tomatoes.\nSo, we can write the following equation:\n<code> 3.0 * X = 42\n X = 42 / 3.0\n X = 14\n</code>\nThe answer is 14.', ""Since Steve eats twice as much as his girlfriend, and he eats 6 tomatoes a day, his girlfriend must eat 3 tomatoes a day. So, together, they eat 9 tomatoes a day.\n\nIf Steve needs 3.0 vines to grow enough tomatoes for their daily consumption, and each vine produces 'X' tomatoes a week, then the total number of tomatoes produced per week is 3.0 * X.\n\nGiven that they eat 9 tomatoes a day, or 63 tomatoes a week, we can write the equation:\n<code> 3.0 * X = 63\n X = 63 / 3.0\n X = 21\n</code>\nThe answer is 21.""]], 2: [['Steve eats X tomatoes a day, and since he eats twice as much as his girlfriend, his girlfriend eats X/2 tomatoes a day. Therefore, the total number of tomatoes they eat daily is X + X/2 = 1.5X.\n\nIf a vine produces 3 tomatoes a week, and Steve needs 14 vines, then the total number of tomatoes he needs per week is 3 * 14 = 42 tomatoes. Since he needs 1.5X tomatoes per day, we can calculate X as follows:\n<code> 1.5X * 7 = 42\n 10.5X = 42\n X = 42 / 10.5\n X = 4\n</code>\nSteve eats 4 cherry tomatoes a day.', ""Let's say Steve eats X tomatoes a day. Since he eats twice as much as his girlfriend, his girlfriend eats X/2 tomatoes a day. Together, they eat X + X/2 = 1.5X tomatoes a day. If a vine produces 3 tomatoes a week, in a day it produces 3/7 tomatoes. Steve needs 14 vines, so the total number of tomatoes produced per day is 14 * 3/7 = 6 tomatoes. Therefore, we can write the following equation:\n1.5X = 6\nX = 6 / 1.5\nX = 4\nSo, the answer is 4."", 'Steve eats X tomatoes a day, which is twice as much as his girlfriend. So his girlfriend eats X/2 tomatoes a day. Together, they eat X + X/2 = 1.5X tomatoes a day. Each vine produces 3 tomatoes a week, so Steve needs 14 vines to produce enough tomatoes for their daily consumption. Therefore:\n<code> 1.5X = 14 * 3\n 1.5X = 42\n X = 42 / 1.5\n X = 28\n</code>\nThe answer is 28.'], ['Steve eats 6 tomatoes a day, which is twice as much as his girlfriend, so his girlfriend eats 6/2 = 3 tomatoes a day. Together, they eat 6 + 3 = 9 tomatoes a day. If a vine produces X tomatoes a week, then in a day it produces X/7 tomatoes. \n\nSince they need 14 vines to satisfy their daily tomato intake, we can write the following equation:\n14 * (X/7) = 9\n\nSolving for X:\n14X/7 = 9\n2X = 9\nX = 9 / 2\nX = 4.5\n\nThe answer is 4.5.', 'Since Steve eats 6 tomatoes a day and his girlfriend eats half of that (3 tomatoes), together they eat 6 + 3 = 9 tomatoes a day. If they need 14 vines of cherry tomatoes, and each vine produces X tomatoes a week, we can set up the following equation:\n9 tomatoes/day * 7 days/week = 14 vines * X tomatoes/vine\n63 tomatoes/week = 14 vines * X tomatoes/vine\nX = 63 / 14\nX = 4.5\nThe answer is 4.5 tomatoes per vine per week.', 'Steve eats 6 tomatoes a day, which is twice as much as his girlfriend. So his girlfriend eats 6/2 = 3 tomatoes a day. Together, they eat 6 + 3 = 9 tomatoes a day. If a vine produces X tomatoes a week, then in a day it produces X/7 tomatoes. To meet their daily consumption, they need 9 vines. However, Steve needs 14 vines, so we can write the following equation:\n9 vines * (X/7 tomatoes per day) = 14 vines\n9X/7 = 14\n9X = 98\nX = 98/9\nX ≈ 10.89\nThe answer is approximately 10.89.']]}","[True, False, False]",1
70,"Mark bought a fleet of 12 cars for his company, each priced at $20,000. He paid a 10% tax on these cars and also paid a $1,000 registration fee per car. How much did he spend in total?","276,000",[],[False],0
