,question,target,CoT,is_true,verifier
0,"Jenny helps in her mom's office. She has a stack of 60 letters that need stamps and a stack of letters that already have stamps. She puts stamps on one-third of the letters needing stamps. If there are now 30 letters in the stack that already have stamps, how many letters were in that stack when Jenny started stamping?",10,"{0: [['Jenny started with X letters that need stamps. She put stamps on one-third of them, which means X/3 letters were stamped. So, the total number of letters is X + X/3. After she stamped them, there were 30 letters in the stack that already had stamps. When Jenny started, there were 10 letters in that stack. Therefore, we can write the following equation:\nX + X/3 + 30 = 10\nX + X/3 = 10 - 30\n4X/3 = -20\n4X = -60\nX = -60/4\nX = -15\n\nThe answer is -15.', 'Jenny started with a stack of X letters that need stamps. After putting stamps on one-third of them, there were 30 letters with stamps and 10 letters still needing stamps. So, we can write the following equation:\nX / 3 = 30 - 10\nX / 3 = 20\nX = 20 * 3\nX = 60\n\nThe answer is 60.', 'Jenny started with X letters needing stamps. She put stamps on one-third of them, so (1/3)X letters now have stamps. There are now 30 letters with stamps, so the remaining letters needing stamps would be 2/3 of X. \n\nTherefore, we can write the equation:\n\n(1/3)X + 30 = X\n\nSolving for X:\n\n30 = (2/3)X\nX = 30 * (3/2)\nX = 45\n\nThe answer is 45.'], ['Jenny started with 60 letters needing stamps and X letters that already have stamps. After she put stamps on one-third of the 60 letters, there were only 10 letters left in the stack needing stamps. So, we can write the following equation:\n60/3 + 10 = X\n20 + 10 = X\nX = 30\nThe answer is 30.', 'Jenny started with 60 letters needing stamps. She put stamps on one-third of them, which is 60/3 = 20 letters. So, after putting stamps on them, there were 40 letters still needing stamps. Therefore, 40 + X (letters with stamps) = total letters, which was 10 initially.\n<code> 40 + X = 10\n X = 10 - 40\n X = -30\n</code>\nThe answer is -30.', 'Jenny started with 60 letters that needed stamps. She stamps one-third of them, so 60/3 = 20 letters were stamped. So, the remaining letters in the stack that need stamps are 60 - 20 = 40 letters. When Jenny started stamping, there were 10 letters in the stack that already had stamps, which means the total number of letters is 10 (already stamped) + 40 (needing stamps) = 50 letters. Therefore, the answer is:\n<code>X = 50\n</code>\nThe answer is 50.']], 1: [['Jenny started with X letters that need stamps. After putting stamps on one-third of them, there were 30 letters with stamps, so 2/3 of the original stack still need stamps. This means:\n<code> 2/3 * X = 70 - 30\n 2/3 * X = 40\n X = 40 * 3/2\n X = 60\n</code>\nThe answer is 60.', 'Jenny started with X letters that needed stamps and a stack of letters that already have stamps. After putting stamps on one-third of the letters needing stamps, there were 30 letters in the stack that already have stamps. So, the total number of letters Jenny started with was 70.\n<code> X + 30 = 70\n X = 70 - 30\n X = 40\n</code>\nThe answer is 40.', 'Jenny started with a stack of X letters that needed stamps and another stack with stamps. She put stamps on one-third of the letters needing stamps, which means 2/3 of the letters still need stamps. After stamping, there were 30 letters in the stack that already have stamps, so there were 40 letters still needing stamps. In total, there were 70 letters when Jenny started.\n<code> X + 30 = 70\n X = 70 - 30\n X = 40\n</code>\nTherefore, the answer is 40.'], ['Jenny started with 60 letters needing stamps. She put stamps on one-third of them, which means 1/3 * 60 = 20 letters now have stamps. So, the total number of letters before putting stamps on any of them was 60 + 20 = 80 letters. If there are now X letters in the stack that already have stamps and there were 70 letters in the stack when Jenny started stamping, we can write the following equation:\n<code> X + 70 = 80\n X = 10\n</code>\nThe answer is 10.', 'Initially, there were a total of 60 + X letters. Jenny put stamps on one-third of the 60 letters, so the number of letters needing stamps decreased by 60/3 = 20. After stamping, there were 70 letters in total.\n<code>60 - 20 + X = 70\n X = 30\n</code>\nThe answer is 30.', 'Jenny started with 60 letters needing stamps. She puts stamps on one-third of them, which is 60/3 = 20 letters. So, after stamping, there are still 60 - 20 = 40 letters needing stamps. If there were originally 70 letters in total, then the stack with stamps must have 70 - 40 = 30 letters.\nTherefore, the answer is X = 30.']]}","[True, False]",1
1,"Mark is a copy editor. He edits an equal number of sentences each week for two different publishers, and they each pay him a different price per sentence. Publisher B pays Mark twice as much as Publisher A. Mark edits a total of 1,000 sentences a week, and Publisher A pays him 5 cents per sentence. How many cents does Mark earn per week?",7500,[],[True],1
